{
  "schema_version": 1,
  "episode": "Can a Harbour card pay a fare on a Northline ferry right now?",
  "outline": [
    {
      "name": "The question",
      "description": "Set up the trip, the card, and why the answer is not obvious.",
      "size": "short"
    },
    {
      "name": "What was signed",
      "description": "The January agreement, its scope, and the missing availability date.",
      "size": "medium"
    },
    {
      "name": "The disagreement",
      "description": "The operator's live list against the trade report, both kept.",
      "size": "medium"
    },
    {
      "name": "What to do",
      "description": "The fallback that works today, marked as the hosts' inference.",
      "size": "short"
    }
  ],
  "speakers": [
    { "name": "Ana", "voice_hint": "warm mid-range, unhurried" },
    { "name": "Ravi", "voice_hint": "brighter, faster, asks the blunt question" }
  ],
  "lines": [
    { "n": 1, "speaker": "Ana", "segment": "The question",
      "text": "You are getting on a Northline ferry next month and you are holding a Harbour card. Does it work?",
      "claims": [], "kind": "transition" },
    { "n": 2, "speaker": "Ravi", "segment": "The question",
      "text": "My instinct says yes, because I read that the two of them signed something in January.",
      "claims": [], "kind": "opinion" },
    { "n": 3, "speaker": "Ana", "segment": "The question",
      "text": "Harbour Transit is not on Northline's live interoperability list, and a Harbour card cannot be used to pay a fare on a Northline service as of the twelfth of February 2026.",
      "claims": ["clm_38d64b78005c"], "kind": "factual" },

    { "n": 4, "speaker": "Ravi", "segment": "What was signed",
      "text": "So what did they actually sign?",
      "claims": [], "kind": "transition" },
    { "n": 5, "speaker": "Ana", "segment": "What was signed",
      "text": "Northline Ferries and the Harbour Transit Authority signed a fare interoperability agreement on the third of January 2026.",
      "claims": ["clm_eb027a5b0314"], "kind": "factual" },
    { "n": 6, "speaker": "Ana", "segment": "What was signed",
      "text": "The signed agreement covers forty-two terminals across the two networks.",
      "claims": ["clm_7372280596d2"], "kind": "factual" },
    { "n": 7, "speaker": "Ravi", "segment": "What was signed",
      "text": "Forty-two terminals and no date. That is the part that tells you where this is.",
      "claims": [], "kind": "opinion" },
    { "n": 8, "speaker": "Ana", "segment": "What was signed",
      "text": "Neither operator has announced a date for passenger availability.",
      "claims": ["clm_b4b1884d43ab"], "kind": "factual" },

    { "n": 9, "speaker": "Ravi", "segment": "The disagreement",
      "text": "But I did read that the deal enables Harbour cards on Northline. I am not making that up.",
      "claims": [], "kind": "banter" },
    { "n": 10, "speaker": "Ana", "segment": "The disagreement",
      "text": "You are not. Trade reporting describes the January 2026 agreement as enabling Harbour cards to be used for fare payment on Northline coastal services.",
      "claims": ["clm_ba5cb17942ab"], "kind": "factual" },
    { "n": 11, "speaker": "Ana", "segment": "The disagreement",
      "text": "Both of those are in the ledger, both marked contested, because one is about what the agreement is for and the other is about what the reader will hit at the gangway.",
      "claims": ["clm_ba5cb17942ab", "clm_38d64b78005c"], "kind": "factual" },
    { "n": 12, "speaker": "Ravi", "segment": "The disagreement",
      "text": "And travellers have been finding out the hard way?",
      "claims": [], "kind": "transition" },
    { "n": 13, "speaker": "Ana", "segment": "The disagreement",
      "text": "Travellers report Harbour cards being declined at the Northline gangway in December 2025 and again in February 2026.",
      "claims": ["clm_377add821344"], "kind": "factual" },
    { "n": 14, "speaker": "Ana", "segment": "The disagreement",
      "text": "That one is marked reported rather than checked. A forum thread tells you what people hit. It does not tell you what the scheme supports.",
      "claims": ["clm_377add821344"], "kind": "factual" },

    { "n": 15, "speaker": "Ravi", "segment": "What to do",
      "text": "So what do I do next month?",
      "claims": [], "kind": "transition" },
    { "n": 16, "speaker": "Ana", "segment": "What to do",
      "text": "Paper tickets and cash remain available at every Northline terminal counter and at the quayside machines.",
      "claims": ["clm_fc44ae58adbc"], "kind": "factual" },
    { "n": 17, "speaker": "Ana", "segment": "What to do",
      "text": "The same travellers report that Meridian card taps work on the routes they used.",
      "claims": ["clm_8b4adc521f32"], "kind": "factual" },
    { "n": 18, "speaker": "Ravi", "segment": "What to do",
      "text": "Cash, a paper ticket, or a Meridian Card. That is ours, not the sources'.",
      "claims": [], "kind": "opinion" },
    { "n": 19, "speaker": "Ana", "segment": "What to do",
      "text": "Recheck the operator's live list before you travel. It is the page every moving claim in this episode links to.",
      "claims": [], "kind": "opinion" }
  ]
}
